{
  "schema_version": "1.0.0",
  "project_id": "dry-run-002",
  "created_at": "2026-09-22T14:00:00Z",
  "status": "complete",
  "product": {
    "name": "LumiFlex — Luminária de Mesa Articulada USB-C (PRODUTO FICTÍCIO — dry-run-002, não real)",
    "category": "Casa e Escritório / Iluminação",
    "description": "Luminária de mesa fictícia usada apenas para teste estrutural da Fase 18. Braço articulado, alimentação USB-C, 3 temperaturas de luz. Nenhum dado deste produto é real.",
    "price": { "amount": 89.9, "currency": "BRL" },
    "key_features": [
      "Braço articulado em 4 pontos (fictício)",
      "3 temperaturas de luz, controle touch (fictício)",
      "Alimentação USB-C, cabo incluso (fictício)"
    ],
    "reference_images": [],
    "tiktok_shop_url": "https://example.invalid/produto-ficticio-dry-run-002"
  }
}
